<?xml version="1.0" encoding="UTF-8"?>
<!DOCTYPE livre SYSTEM "ex1.dtd">
<livre>
  <titre>Le Silence des agneaux</titre>
  <auteur>
    <nom>Harris</nom>
     <prenom>Thomas</prenom>
  </auteur>
  <version pays="US">
    <date>1988</date>
    <editeur>St. Martin's Press</editeur>
    <ISBN>0-312-02282-4</ISBN>
  </version>
  <serie>
    <previous>Dragon rouge</previous>
    <following>Hannibal</following>
  </serie>
  <resume></resume>
  <personnages></personnages>
  <adaptation></adaptation>
</livre>
